==============================================================================
MULTI-MODEL EVALUATION RESULTS
==============================================================================

Models: gpt-4o, gpt-4o-mini, claude-sonnet-4-20250514

------------------------------------------------------------------------------
PER-MODEL SUMMARY
------------------------------------------------------------------------------

Model                  Passed   Failed   Warned    Total  Pass Rate
-------------------------------------------------------------------
gpt-4o                      1        0        0        1     100.0%
gpt-4o-mini                 1        0        0        1     100.0%
claude-sonnet-4-20250514        1        0        0        1     100.0%

Best Overall: gpt-4o (100.0% pass rate)

------------------------------------------------------------------------------
CROSS-MODEL COMPARISON
------------------------------------------------------------------------------

Suite: LinkedIn Tools Evaluation

Case                                 gpt-4o  gpt-4o-mini  claude-sonn            Best
-------------------------------------------------------------------------------------
Run code                            OK 100%       OK 89%      OK 100%             Tie

  Detailed Results:
  ----------------------------------------------------------------------
  Case: Run code
    [gpt-4o] Score: 100.0%
      Run Stats:
        Runs: 3
        Mean Score: 100.00%
        Std Deviation: 0.00%
        Scores: 100.00%, 100.00%, 100.00%
        Seed Policy: random
        Run Seeds: 1211275093, 681762892, 1626801149
        Pass Rule: majority
        Run Results:
          Run 1: PASSED (100.00%)
          Run 2: PASSED (100.00%)
          Run 3: PASSED (100.00%)

      Critic Stats:
        context: norm 0.00% ± 0.00% | weighted 0.00% ± 0.00% (w=0.00)
        text: norm 100.00% ± 0.00% | weighted 100.00% ± 0.00% (w=1.00)

      tool_selection: Match
           Score: 1.00/1.00
           Expected: Linkedin_CreateTextPost
           Actual: Linkedin_CreateTextPost
      text: Match
           Score: 1.00/1.00
           Expected: It is with great pleasure that I announce that I am now a member of the LinkedIn community! I'd like to thank the LinkedIn team for their support and encouragement in my journey to success. #Y2K
           Actual: It is with great pleasure that I announce that I am now a member of the LinkedIn community! I'd like to thank the LinkedIn team for their support and encouragement in my journey to success. #Y2K
      context: Un-criticized
           Expected: None
           Actual: None
    [gpt-4o-mini] Score: 89.3%
      Run Stats:
        Runs: 3
        Mean Score: 89.29%
        Std Deviation: 3.71%
        Scores: 86.67%, 86.67%, 94.53%
        Seed Policy: random
        Run Seeds: 1028755920, 655606574, 1811611459
        Pass Rule: majority
        Run Results:
          Run 1: PASSED (86.67%)
          Run 2: PASSED (86.67%)
          Run 3: PASSED (94.53%)

      Critic Stats:
        context: norm 0.00% ± 0.00% | weighted 0.00% ± 0.00% (w=0.00)
        text: norm 78.58% ± 7.41% | weighted 78.58% ± 7.41% (w=1.00)

      tool_selection: Match
           Score: 1.00/1.00
           Expected: Linkedin_CreateTextPost
           Actual: Linkedin_CreateTextPost
      text: Match
           Score: 0.89/1.00
           Expected: It is with great pleasure that I announce that I am now a member of the LinkedIn community! I'd like to thank the LinkedIn team for their support and encouragement in my journey to success. #Y2K
           Actual: It is with great pleasure that I announce I am now a member of the LinkedIn community! I want to thank the LinkedIn team for their support and encouragement on my journey to success. #Y2K
      context: Un-criticized
           Expected: None
           Actual: None
    [claude-sonnet-4-20250514] Score: 100.0%
      Run Stats:
        Runs: 3
        Mean Score: 100.00%
        Std Deviation: 0.00%
        Scores: 100.00%, 100.00%, 100.00%
        Seed Policy: random (ignored)
        Pass Rule: majority
        Run Results:
          Run 1: PASSED (100.00%)
          Run 2: PASSED (100.00%)
          Run 3: PASSED (100.00%)

      Critic Stats:
        context: norm 0.00% ± 0.00% | weighted 0.00% ± 0.00% (w=0.00)
        text: norm 100.00% ± 0.00% | weighted 100.00% ± 0.00% (w=1.00)

      tool_selection: Match
           Score: 1.00/1.00
           Expected: Linkedin_CreateTextPost
           Actual: Linkedin_CreateTextPost
      text: Match
           Score: 1.00/1.00
           Expected: It is with great pleasure that I announce that I am now a member of the LinkedIn community! I'd like to thank the LinkedIn team for their support and encouragement in my journey to success. #Y2K
           Actual: It is with great pleasure that I announce that I am now a member of the LinkedIn community! I'd like to thank the LinkedIn team for their support and encouragement in my journey to success. #Y2K
      context: Un-criticized
           Expected: None
           Actual: None


==============================================================================
Summary -- Unique Cases: 1 -- Total Evaluations: 3 (3 models)
         Passed: 3 -- Failed: 0 -- Warned: 0
